{
  "eventId": "11111111-1111-4111-8111-111111111111",
  "type": "vistay.auth.account-provisioned",
  "version": 1,
  "aggregateId": "22222222-2222-4222-8222-222222222222",
  "aggregateVersion": 1,
  "correlationId": "aaaaaaaa-aaaa-4aaa-8aaa-aaaaaaaaaaaa",
  "causationId": null,
  "occurredAt": "2026-10-23T03:00:00Z",
  "data": {
    "accountId": "22222222-2222-4222-8222-222222222222",
    "realm": "BACKOFFICE",
    "email": "operator@vistay.vn",
    "displayName": "ViStay Operator",
    "provisionedAt": "2026-10-23T03:00:00Z"
  }
}
