{
  "eventId": "33333333-3333-4333-8333-333333333333",
  "type": "vistay.user.profile-provisioned",
  "version": 1,
  "aggregateId": "44444444-4444-4444-8444-444444444444",
  "aggregateVersion": 1,
  "correlationId": "aaaaaaaa-aaaa-4aaa-8aaa-aaaaaaaaaaaa",
  "causationId": "11111111-1111-4111-8111-111111111111",
  "occurredAt": "2026-10-23T03:00:01Z",
  "data": {
    "profileId": "44444444-4444-4444-8444-444444444444",
    "accountId": "22222222-2222-4222-8222-222222222222",
    "realm": "BACKOFFICE",
    "email": "operator@vistay.vn",
    "displayName": "ViStay Operator",
    "authorizationVersion": 1,
    "provisionedAt": "2026-10-23T03:00:01Z"
  }
}
